"Name","Address","Website","Type","Awards offered","Campus setting","Campus housing","Student population","Undergraduate students","Graduation Rate","Transfer-Out Rate","Cohort Year *","Net Price **","Largest Program","IPEDS ID","OPE ID"
"Tri County Regional Vocational Technical High School","147 Pond St, Franklin, Massachusetts 02038","www.tri-county.us","< 2-year, Public","One but less than two years certificate","Suburb: Large","No","58","58","100%","NA","2013-14","$12,576","Practical Nursing, Vocational Nursing and Nursing Assistants, Other","459408","04122000"
"Tufts University","Medford, Massachusetts 02155-5555","www.tufts.edu","4-year, Private not-for-profit","Bachelor's degree|Postbaccalaureate certificate|Master's degree|Post-master's certificate|Doctor's degree - research/scholarship|Doctor's degree - professional practice","Suburb: Large","Yes","11489","5508","92%","3%","Fall 2010","$28,076","-","168148","00221900"
"Universal Technical Institute of Massachusetts Inc","One Upland Road, Building 200, Norwood, Massachusetts 02062","www.uti.edu/","2-year, Private for-profit","One but less than two years certificate|Two but less than 4 years certificate","Suburb: Large","No","689","689","59%","NA","Fall 2013","$17,664","Automobile/Automotive Mechanics Technology/Technician","447403","00822105"
"University of Massachusetts Medical School Worcester","55 Lake Ave North, Worcester, Massachusetts 01655","www.umassmed.edu","4-year, Public","Master's degree|Post-master's certificate|Doctor's degree - research/scholarship|Doctor's degree - professional practice","City: Midsize","No","1108","","NA","NA","Fall 2010","NA","-","166708","00975600"
"University of Massachusetts-Amherst","374 Whitmore Building 181 Presidents Drive, Amherst, Massachusetts 01003","www.umass.edu","4-year, Public","Less than one year certificate|Associate's degree|Bachelor's degree|Postbaccalaureate certificate|Master's degree|Doctor's degree - research/scholarship|Doctor's degree - professional practice","Suburb: Large","Yes","30037","23373","76%","18%","Fall 2010","$20,093","-","166629","00222100"
"University of Massachusetts-Boston","100 Morrissey Boulevard, Boston, Massachusetts 02125-3393","www.umb.edu","4-year, Public","Less than one year certificate|Bachelor's degree|Postbaccalaureate certificate|Master's degree|Post-master's certificate|Doctor's degree - research/scholarship|Doctor's degree - professional practice","City: Large","No","16847","12847","45%","34%","Fall 2010","$11,966","-","166638","00222200"
"University of Massachusetts-Dartmouth","285 Old Westport Rd, North Dartmouth, Massachusetts 02747-2300","www.umassd.edu","4-year, Public","Less than one year certificate|One but less than two years certificate|Bachelor's degree|Postbaccalaureate certificate|Master's degree|Post-master's certificate|Doctor's degree - research/scholarship|Doctor's degree - professional practice","Suburb: Midsize","Yes","8647","6999","48%","NA","Fall 2010","$16,898","-","167987","00221000"
"University of Massachusetts-Lowell","1 University Ave, Lowell, Massachusetts 01854-5104","www.uml.edu","4-year, Public","Less than one year certificate|Associate's degree|Bachelor's degree|Postbaccalaureate certificate|Master's degree|Post-master's certificate|Doctor's degree - research/scholarship|Doctor's degree - professional practice","Suburb: Large","Yes","17849","13637","56%","NA","Fall 2010","$18,348","-","166513","00216100"
"University of Phoenix-Massachusetts","19 Granite Street, Braintree, Massachusetts 02184-1744","www.phoenix.edu","4-year, Private for-profit","Bachelor's degree|Master's degree","Suburb: Large","No","66","55","6%","NA","Fall 2010","NA","-","440420","32098874"
"Upper Cape Cod Regional Technical School","220 Sandwich Road, Bourne, Massachusetts 02532","www.uppercapetech.com","< 2-year, Public","One but less than two years certificate","Suburb: Midsize","No","79","79","78%","NA","2013-14","$18,618","Licensed Practical/Vocational Nurse Training","373711","00466900"
"Urban College of Boston","2 Boylston Street, 2nd Floor, Boston, Massachusetts 02116","www.urbancollege.edu","2-year, Private not-for-profit","One but less than two years certificate|Associate's degree","City: Large","No","860","860","0%","NA","Fall 2013","$14,222","-","429128","03130500"
"Wellesley College","106 Central St, Wellesley, Massachusetts 02481-8203","www.wellesley.edu","4-year, Private not-for-profit","Bachelor's degree","Suburb: Large","Yes","2482","2482","91%","NA","Fall 2010","$20,013","-","168218","00222400"
"Wentworth Institute of Technology","194 Freeport Street, Dorchester, Massachusetts 02122-2841","www.wit.edu","2-year, Private not-for-profit","Associate's degree","City: Large","","","","NA","NA","Fall 2013","NA","-","16822702","00222502"
"Wentworth Institute of Technology","777 Ellsbree Street, Fall River, Massachusetts 02720-7399","www.wit.edu","2-year, Private not-for-profit","Associate's degree","Suburb: Large","","","","NA","NA","Fall 2013","NA","-","16822703","00222503"
"Wentworth Institute of Technology","550 Huntington Ave, Boston, Massachusetts 02115","https://WIT.EDU","4-year, Private not-for-profit","Less than one year certificate|Associate's degree|Bachelor's degree|Master's degree","City: Large","Yes","4526","4317","65%","NA","Fall 2010","$36,579","-","168227","00222500"
"Wentworth Institute of Technology","750 Dorchester Avenue, Boston, Massachusetts 02125-1132","www.wit.edu","2-year, Private not-for-profit","Associate's degree","Suburb: Large","","","","NA","NA","Fall 2013","NA","-","16822701","00222501"
"Western New England University","1215 Wilbraham Rd, Springfield, Massachusetts 01119-2684","www1.wne.edu","4-year, Private not-for-profit","Less than one year certificate|Associate's degree|Bachelor's degree|Postbaccalaureate certificate|Master's degree|Doctor's degree - research/scholarship|Doctor's degree - professional practice","City: Midsize","Yes","3810","2724","62%","25%","Fall 2010","$29,109","-","168254","00222600"
"Westfield State University","577 Western Ave, Westfield, Massachusetts 01086-1630","www.westfield.ma.edu","4-year, Public","Bachelor's degree|Postbaccalaureate certificate|Master's degree|Post-master's certificate","Suburb: Large","Yes","6335","5633","66%","NA","Fall 2010","$15,593","-","168263","00218900"
"Wheaton College","26 E Main St, Norton, Massachusetts 02766-2322","www.wheatoncollege.edu","4-year, Private not-for-profit","Bachelor's degree","Suburb: Large","Yes","1651","1651","79%","NA","Fall 2010","$32,821","-","168281","00222700"
"Wheelock College","200 Riverway, Boston, Massachusetts 02215-4104","www.wheelock.edu","4-year, Private not-for-profit","Bachelor's degree|Postbaccalaureate certificate|Master's degree","City: Large","Yes","1053","726","61%","NA","Fall 2010","$29,133","-","168290","00222800"
"William James College","One Wells Avenue, Newton, Massachusetts 02459","www.williamjames.edu","4-year, Private not-for-profit","Postbaccalaureate certificate|Master's degree|Doctor's degree - professional practice","City: Small","No","703","","NA","NA","Fall 2010","NA","-","166717","02163600"
"Williams College","880 Main St, Williamstown, Massachusetts 01267","https://www.williams.edu","4-year, Private not-for-profit","Bachelor's degree|Master's degree","Town: Fringe","Yes","2150","2093","94%","NA","Fall 2010","$18,167","-","168342","00222900"
"Worcester Polytechnic Institute","100 Institute Road, Worcester, Massachusetts 01609-2280","https://www.wpi.edu/","4-year, Private not-for-profit","Bachelor's degree|Master's degree|Doctor's degree - research/scholarship","City: Midsize","Yes","6642","4432","86%","NA","Fall 2010","$40,666","-","168421","00223300"
"Worcester State University","486 Chandler St, Worcester, Massachusetts 01602-2597","www.worcester.edu","4-year, Public","Bachelor's degree|Postbaccalaureate certificate|Master's degree|Post-master's certificate","City: Midsize","Yes","6471","5381","56%","25%","Fall 2010","$15,603","-","168430","00219000"
"","* Cohort Year represents the year for which students began their studies and applies to Graduation and Transfer Out Rates.","","","","","","","","","","","","","",""
"","** Net Price is Average Net Price for 2015-2016 generated for full-time beginning undergraduate students who were awarded grant or scholarship aid from federal, state or local governments, or the institution. For public institutions only students paying the in-state or in-district rate are included.  For institutions that charge students by program, net price is generated for the institutions largest program.","","","","","","","","","","","","","",""
"","NA (Not applicable) - Graduation rate, transfer-out rate and the net price are not applicable to institutions that do not have full-time, first-time degree-seeking undergraduate students in the applicable cohort year or the financial aid year.","","","","","","","","","","","","","",""
