"Name","Address","Website","Type","Awards offered","Campus setting","Campus housing","Student population","Undergraduate students","Graduation Rate","Transfer-Out Rate","Cohort Year *","Net Price **","Largest Program","IPEDS ID","OPE ID"
"Longy School of Music of Bard College","27 Garden Street, Cambridge, Massachusetts 02138","longy.edu","4-year, Private not-for-profit","Two but less than 4 years certificate|Postbaccalaureate certificate|Master's degree|Post-master's certificate","City: Midsize","No","219","47","75%","NA","Fall 2010","$35,445","-","166489","00267104"
"Lowell Academy Hairstyling Institute","136 Central St, Lowell, Massachusetts 01852-1909","www.lowellacademy.com","< 2-year, Private for-profit","Less than one year certificate|One but less than two years certificate","Suburb: Large","No","156","156","66%","NA","2013-14","$17,664","Cosmetology/Cosmetologist, General","166498","00989900"
"Mansfield Beauty Schools-Quincy","200 Parking Way, Quincy, Massachusetts 02169","www.mansfieldbeautyschools.edu","< 2-year, Private for-profit","Less than one year certificate|One but less than two years certificate","Suburb: Large","No","35","35","93%","NA","2013-14","$8,281","Cosmetology/Cosmetologist, General","166595","01204200"
"Mansfield Beauty Schools-Springfield","266 Bridge St, Springfield, Massachusetts 01103","mansfieldbeautyschools.edu","< 2-year, Private for-profit","Less than one year certificate|One but less than two years certificate","City: Midsize","No","20","20","80%","NA","2013-14","$17,718","Cosmetology/Cosmetologist, General","166586","01206800"
"Massachusetts Bay Community College","50 Oakland St, Wellesley Hills, Massachusetts 02481-5399","www.massbay.edu","2-year, Public","Less than one year certificate|One but less than two years certificate|Associate's degree","Suburb: Large","No","4855","4855","20%","26%","Fall 2013","$11,576","-","166647","00217100"
"Massachusetts College of Art and Design","621 Huntington Ave, Boston, Massachusetts 02115-5882","www.massart.edu","4-year, Public","Less than one year certificate|One but less than two years certificate|Bachelor's degree|Postbaccalaureate certificate|Master's degree","City: Large","Yes","1982","1842","72%","NA","Fall 2010","$21,695","-","166674","00218000"
"Massachusetts College of Liberal Arts","375 Church Street, North Adams, Massachusetts 01247-4100","www.mcla.edu","4-year, Public","Less than one year certificate|Bachelor's degree|Postbaccalaureate certificate|Master's degree|Post-master's certificate","Town: Fringe","Yes","1644","1444","53%","NA","Fall 2010","$15,035","-","167288","00218700"
"Massachusetts General Hospital Dietetic Internship","Fruit St, Boston, Massachusetts 02114-2696","www.massgeneral.org/dietetic/","4-year, Private not-for-profit","Postbaccalaureate certificate","City: Large","No","22","","NA","NA","Fall 2010","NA","Dietetics/Dietitian","431594","02137200"
"Massachusetts Institute of Technology","77 Massachusetts Avenue, Cambridge, Massachusetts 02139-4307","web.mit.edu/","4-year, Private not-for-profit","Bachelor's degree|Master's degree|Doctor's degree - research/scholarship","City: Midsize","Yes","11376","4524","93%","NA","Fall 2010","$21,576","-","166683","00217800"
"Massachusetts Maritime Academy","101 Academy Dr, Buzzards Bay, Massachusetts 02532-1803","www.maritime.edu","4-year, Public","Bachelor's degree|Master's degree","Suburb: Midsize","Yes","1751","1677","76%","NA","Fall 2010","$14,035","-","166692","00218100"
"Massachusetts School of Barbering","58 Ross Way, Quincy, Massachusetts 02169","massschoolofbarbering.com","< 2-year, Private for-profit","One but less than two years certificate","Suburb: Large","No","67","67","100%","NA","2013-14","$11,672","Barbering/Barber","166805","02092100"
"Massachusetts School of Law","500 Federal St Woodland Park, Andover, Massachusetts 01810","www.mslaw.edu","4-year, Private not-for-profit","Doctor's degree - professional practice","Suburb: Large","No","328","","NA","NA","Fall 2010","NA","-","369002","03235300"
"Massasoit Community College","One Massasoit Boulevard, Brockton, Massachusetts 02302-3996","www.massasoit.mass.edu","2-year, Public","Less than one year certificate|One but less than two years certificate|Associate's degree","Suburb: Large","No","7471","7471","15%","23%","Fall 2013","$7,639","-","166823","00217700"
"MCPHS University","179 Longwood Ave, Boston, Massachusetts 02115-5896","www.mcphs.edu","4-year, Private not-for-profit","Less than one year certificate|Bachelor's degree|Postbaccalaureate certificate|Master's degree|Post-master's certificate|Doctor's degree - research/scholarship|Doctor's degree - professional practice","City: Large","Yes","7095","3843","78%","8%","Fall 2010","$37,422","-","166656","00216500"
"Medical Professional Institute","380-388 Pleasant Street, Malden, Massachusetts 02148-8143","www.mpi.edu","< 2-year, Private for-profit","Less than one year certificate|One but less than two years certificate","Suburb: Large","No","86","86","71%","NA","2013-14","NA","Phlebotomy Technician/Phlebotomist","444769","03763300"
"Merrimack College","315 Turnpike St, North Andover, Massachusetts 01845","www.merrimack.edu","4-year, Private not-for-profit","Bachelor's degree|Master's degree|Post-master's certificate","Suburb: Large","Yes","4014","3433","73%","NA","Fall 2010","$33,003","-","166850","00212000"
"MGH Institute of Health Professions","36 1st Avenue, Boston, Massachusetts 02129-4557","www.mghihp.edu","4-year, Private not-for-profit","Bachelor's degree|Postbaccalaureate certificate|Master's degree|Post-master's certificate|Doctor's degree - research/scholarship|Doctor's degree - professional practice","City: Large","No","1167","188","NA","NA","Fall 2010","NA","-","166869","02231600"
"Middlesex Community College","Springs Rd, Bedford, Massachusetts 01730-9124","www.middlesex.mass.edu","2-year, Public","Less than one year certificate|One but less than two years certificate|Associate's degree","Suburb: Large","No","8617","8617","19%","22%","Fall 2013","$4,288","-","166887","00993600"
"Mildred Elley-Pittsfield Campus","100 West Street, Pittsfield, Massachusetts 01201-5300","www.mildred-elley.edu","< 2-year, Private for-profit","One but less than two years certificate","City: Small","No","250","250","40%","NA","2013-14","$19,739","-","425986","02219501"
"Millennium Training Institute","600 West Cummings Park, Suite 2550, Woburn, Massachusetts 01801","www.millennium.edu","< 2-year, Private for-profit","Less than one year certificate","Suburb: Large","No","108","108","60%","NA","2013-14","$13,319","Accounting Technology/Technician and Bookkeeping","451264","04128000"
"Montserrat College of Art","23 Essex Street, Beverly, Massachusetts 01915-4508","https://www.montserrat.edu/","4-year, Private not-for-profit","Two but less than 4 years certificate|Bachelor's degree","Suburb: Large","Yes","377","377","56%","NA","Fall 2010","$27,908","-","166911","02063000"
"Monty Tech","1050 Westminster St, Fitchburg, Massachusetts 01420","www.montytech.net","< 2-year, Public","One but less than two years certificate","Suburb: Midsize","No","44","44","88%","NA","2013-14","$10,755","Licensed Practical/Vocational Nurse Training","433040","01288100"
"Motoring Technical Training Institute","1241 Fall River Avenue, Seekonk, Massachusetts 02771","www.mtti.edu","< 2-year, Private for-profit","Less than one year certificate|One but less than two years certificate","Suburb: Large","No","361","361","92%","NA","2013-14","$12,847","Automobile/Automotive Mechanics Technology/Technician","414124","03115200"
"Mount Holyoke College","50 College Street, South Hadley, Massachusetts 01075-1489","www.mtholyoke.edu","4-year, Private not-for-profit","Bachelor's degree|Postbaccalaureate certificate|Master's degree","Suburb: Large","Yes","2327","2199","84%","13%","Fall 2010","$27,234","-","166939","00219200"
"Mount Ida College","777 Dedham Street, Newton, Massachusetts 02459","www.mountida.edu","4-year, Private not-for-profit","Associate's degree|Bachelor's degree|Master's degree","City: Small","Yes","1394","1357","43%","NA","Fall 2010","$25,947","-","166948","00219300"
"Mount Wachusett Community College","444 Green St, Gardner, Massachusetts 01440-1000","MWCC.EDU","2-year, Public","Less than one year certificate|One but less than two years certificate|Associate's degree","Rural: Fringe","No","3961","3961","22%","18%","Fall 2013","$7,638","-","166957","00217200"
"National Aviation Academy of New England","130 Baker Ave Extension, Concord, Massachusetts 01742","www.naa.edu","2-year, Private for-profit","Two but less than 4 years certificate","Suburb: Large","No","189","189","63%","NA","Fall 2013","$21,078","Airframe Mechanics and Aircraft Maintenance Technology/Technician","165635","00613600"
"National Graduate School of Quality Management","186 Jones Road, Falmouth, Massachusetts 02540-2958","www.ngs.edu","4-year, Private not-for-profit","Bachelor's degree|Master's degree|Doctor's degree","Suburb: Midsize","No","256","101","NA","NA","Fall 2010","NA","-","441478","03504300"
"National Personal Training Institute of Massachusetts","249 Lexington Street, Waltham, Massachusetts 02452-4682","nationalpti.edu/school/boston-ma/","< 2-year, Private for-profit","Less than one year certificate","City: Small","No","","","NA","NA","2013-14","$12,354","Physical Fitness Technician","488323","04251600"
"New England College of Business and Finance","10 High St Ste 204, Boston, Massachusetts 02110","www.necb.edu/","4-year, Private for-profit","Less than one year certificate|Associate's degree|Bachelor's degree|Postbaccalaureate certificate|Master's degree","City: Large","No","1131","910","42%","NA","Fall 2010","NA","-","164438","03965300"
"New England College of Optometry","424 Beacon St, Boston, Massachusetts 02115","www.neco.edu","4-year, Private not-for-profit","Master's degree|Post-master's certificate|Doctor's degree - professional practice","City: Large","No","533","","NA","NA","Fall 2010","NA","-","167093","00216400"
"New England Hair Academy","492-500 Main St, Malden, Massachusetts 02148","www.newenglandhairacademy.com","< 2-year, Private for-profit","Less than one year certificate|One but less than two years certificate","Suburb: Large","No","160","160","75%","NA","2013-14","$13,959","Cosmetology/Cosmetologist, General","373678","02122000"
"New England Law-Boston","154 Stuart St, Boston, Massachusetts 02116","www.nesl.edu","4-year, Private not-for-profit","Doctor's degree - professional practice","City: Large","No","622","","NA","NA","Fall 2010","NA","-","167215","00891600"
"New England School of Photography","274 Moody Street, Waltham, Massachusetts 02453","https://www.NESOP.edu","< 2-year, Private for-profit","One but less than two years certificate","City: Large","No","62","62","67%","NA","2013-14","$38,896","-","167224","02163500"
"New England Tractor Trailer Training School of Massachusetts","1600 Osgood Street, North Andover, Massachusetts 01845-1048","www.nettts.com","< 2-year, Private for-profit","Less than one year certificate|One but less than two years certificate","Suburb: Large","No","448","448","72%","NA","2013-14","$12,394","Truck and Bus Driver/Commercial Vehicle Operator and Instructor","468963","02584401"
"Newbury College","129 Fisher Ave, Brookline, Massachusetts 02445","www.newbury.edu","4-year, Private not-for-profit","Less than one year certificate|Associate's degree|Bachelor's degree","Suburb: Large","Yes","751","751","42%","34%","Fall 2010","$22,831","-","167251","00748400"
"Nichols College","Center Rd, Dudley, Massachusetts 01571-5000","www.nichols.edu","4-year, Private not-for-profit","Associate's degree|Bachelor's degree|Master's degree","Suburb: Large","Yes","1480","1269","41%","NA","Fall 2010","$29,302","-","167260","00219700"
"North Bennet Street School","150 North Street, Boston, Massachusetts 02109","www.nbss.edu","2-year, Private not-for-profit","One but less than two years certificate|Two but less than 4 years certificate","City: Large","No","158","158","71%","NA","Fall 2013","$35,143","Furniture Design and Manufacturing","167297","02197900"
"North Shore Community College","1 Ferncroft Rd, Danvers, Massachusetts 01923-0840","www.northshore.edu","2-year, Public","Less than one year certificate|One but less than two years certificate|Associate's degree","Suburb: Large","No","6315","6315","17%","20%","Fall 2013","$7,657","-","167312","00217300"
"Northeastern University","360 Huntington Ave, Boston, Massachusetts 02115-5005","www.northeastern.edu","4-year, Private not-for-profit","Bachelor's degree|Master's degree|Post-master's certificate|Doctor's degree - research/scholarship|Doctor's degree - professional practice|Doctor's degree - other","City: Large","Yes","20381","13473","86%","NA","Fall 2010","$29,998","-","167358","00219900"
"Northeastern University Professional Advancement Network","360 Huntington Ave, Boston, Massachusetts 02115","www.northeastern.edu/globalnetwork","4-year, Private not-for-profit","Associate's degree|Bachelor's degree|Master's degree|Post-master's certificate|Doctor's degree - professional practice|Doctor's degree - other","City: Large","No","10148","3221","NA","NA","Fall 2010","NA","-","482705","00219900"
"Northern Essex Community College","100 Elliott Street, Haverhill, Massachusetts 01830-2399","www.necc.mass.edu/","2-year, Public","Less than one year certificate|One but less than two years certificate|Associate's degree","Suburb: Large","No","5976","5976","19%","19%","Fall 2013","$8,674","-","167376","00217400"
"Northpoint Bible College","320 South Main Street, Haverhill, Massachusetts 01835","www.northpoint.edu","4-year, Private not-for-profit","One but less than two years certificate|Associate's degree|Bachelor's degree|Master's degree","Suburb: Large","Yes","345","327","53%","15%","Fall 2010","$19,696","-","217606","03570500"
"Pine Manor College","400 Heath St, Chestnut Hill, Massachusetts 02467","www.pmc.edu","4-year, Private not-for-profit","Associate's degree|Bachelor's degree|Master's degree","Suburb: Large","Yes","490","461","29%","NA","Fall 2010","$21,241","-","167455","00220100"
"Pope St John XXIII National Seminary","558 South Ave, Weston, Massachusetts 02493-2699","www.psjs.edu","4-year, Private not-for-profit","Master's degree","Suburb: Large","Yes","58","","NA","NA","Fall 2010","NA","-","167464","00220200"
"Porter and Chester Institute of Canton","5 Campanelli Circle, Canton, Massachusetts 02021-2480","www.porterchester.com","< 2-year, Private for-profit","One but less than two years certificate","Suburb: Large","No","","","NA","NA","2013-14","NA","-","13017406","01077914"
"Porter and Chester Institute of Chicopee","134 Dulong Cir, Chicopee, Massachusetts 01022-1400","www.porterchester.com","< 2-year, Private for-profit","One but less than two years certificate","Suburb: Large","No","","","NA","NA","2013-14","NA","-","13017404","01077905"
"Porter and Chester Institute of Woburn","8 Presidential Way, Woburn, Massachusetts 01801-1041","www.porterchester.com","< 2-year, Private for-profit","One but less than two years certificate","Suburb: Large","No","","","NA","NA","2013-14","NA","-","13017407","01077916"
"Porter and Chester Institute of Worcester","220 Brooks Street, Worcester, Massachusetts 01606-1400","www.porterchester.com","< 2-year, Private for-profit","One but less than two years certificate","City: Midsize","No","","","NA","NA","2013-14","NA","-","13017405","01077906"
"Quincy College","1250 Hancock Street, Quincy, Massachusetts 02169","https://www.quincycollege.edu","2-year, Public","Less than one year certificate|One but less than two years certificate|Associate's degree","Suburb: Large","No","5009","5009","13%","22%","Fall 2013","$12,615","-","167525","00220500"
"Quinsigamond Community College","670 West Boylston Street, Worcester, Massachusetts 01606-2092","www.qcc.edu","2-year, Public","Less than one year certificate|One but less than two years certificate|Associate's degree","City: Midsize","No","7696","7696","21%","19%","Fall 2013","$7,215","-","167534","00217500"
"Regis College","235 Wellesley St, Weston, Massachusetts 02493-1571","www.regiscollege.edu","4-year, Private not-for-profit","Associate's degree|Bachelor's degree|Postbaccalaureate certificate|Master's degree|Post-master's certificate|Doctor's degree - professional practice","Suburb: Large","Yes","1847","1226","54%","NA","Fall 2010","$27,777","-","167598","00220600"
"Rob Roy Academy-Fall River","260 S Main St, Fall River, Massachusetts 02720-3445","www.rob-roy.com","< 2-year, Private for-profit","Less than one year certificate|One but less than two years certificate","Suburb: Large","No","65","65","51%","NA","2013-14","$19,258","Cosmetology/Cosmetologist, General","165750","01294800"
"Rob Roy Academy-New Bedford","1872 Acushnet Ave, New Bedford, Massachusetts 02720-3445","www.rob-roy.com","< 2-year, Private for-profit","One but less than two years certificate","Suburb: Midsize","No","19","19","43%","NA","2013-14","$18,634","Cosmetology/Cosmetologist, General","167039","02339400"
"Rob Roy Academy-Taunton","1 School St, Taunton, Massachusetts 02780-5339","www.rob-roy.com","< 2-year, Private for-profit","Less than one year certificate|One but less than two years certificate","Suburb: Large","No","20","20","48%","NA","2013-14","$16,980","Cosmetology/Cosmetologist, General","168032","02137000"
"Rob Roy Academy-Worcester","150 Pleasant St, Worcester, Massachusetts 01609","www.rob-roy.com","< 2-year, Private for-profit","Less than one year certificate|One but less than two years certificate","City: Midsize","No","148","148","37%","NA","2013-14","$17,176","Cosmetology/Cosmetologist, General","373696","02181600"
"Roxbury Community College","1234 Columbus Ave, Roxbury Crossing, Massachusetts 02120-3400","www.rcc.mass.edu","2-year, Public","Less than one year certificate|One but less than two years certificate|Associate's degree","City: Large","No","2106","2106","9%","28%","Fall 2013","$6,444","-","167631","01193000"
"Saint John's Seminary","127 Lake Street, Brighton, Massachusetts 02135-3846","www.sjs.edu","4-year, Private not-for-profit","Bachelor's degree|Master's degree","City: Large","Yes","184","45","NA","NA","Fall 2010","NA","-","167677","00221400"
"Salem State University","352 Lafayette St, Salem, Massachusetts 01970","www.salemstate.edu","4-year, Public","Bachelor's degree|Postbaccalaureate certificate|Master's degree|Post-master's certificate","Suburb: Large","Yes","9001","7346","52%","NA","Fall 2010","$16,556","-","167729","00218800"
"Salter College-Chicopee","645 Shawinigan Drive, Chicopee, Massachusetts 01020-3744","www.salter.edu","2-year, Private for-profit","Less than one year certificate|One but less than two years certificate|Associate's degree","Suburb: Large","No","131","131","36%","NA","Fall 2013","$22,914","Allied Health and Medical Assisting Services, Other","466523","00466608"
"Salter College-West Boylston","184 West Boylston Suite # 1, West Boylston, Massachusetts 01583","www.salter.edu","2-year, Private for-profit","One but less than two years certificate|Associate's degree","Suburb: Large","No","216","216","43%","NA","Fall 2013","$19,870","Medical/Clinical Assistant","167738","00466600"
"Salter School-Fall River","82 Hartwell Street, Fall River, Massachusetts 02720","www.salterschool.com/Locations/Fall-River-Campus/80/","< 2-year, Private for-profit","One but less than two years certificate","Suburb: Large","No","115","115","53%","NA","2013-14","$18,781","Medical/Clinical Assistant","447494","00466604"
"School of the Museum of Fine Arts at Tufts University","230 The Fenway, Boston, Massachusetts 02115-5596","www.smfa.edu/","4-year, Private not-for-profit","Less than one year certificate|Two but less than 4 years certificate|Bachelor's degree|Postbaccalaureate certificate|Master's degree","City: Large","No","","","58%","23%","Fall 2010","NA","-","166984","00466700"
"Shawsheen Valley School of Practical Nursing","100 Cook St, Billerica, Massachusetts 01821-5499","www.shawsheen.tec.ma.us","< 2-year, Public","One but less than two years certificate","Suburb: Large","No","39","39","86%","NA","2013-14","$14,794","Licensed Practical/Vocational Nurse Training","412535","03104000"
"Signature Healthcare Brockton Hospital School of Nursing","680 Centre St, Brockton, Massachusetts 02302-1905","www.bhson.org","2-year, Private not-for-profit","Two but less than 4 years certificate","Suburb: Large","No","260","260","0%","50%","Fall 2013","$24,237","Registered Nursing/Registered Nurse","165060","00632200"
"Simmons College","300 The Fenway, Boston, Massachusetts 02115-5898","www.simmons.edu","4-year, Private not-for-profit","Bachelor's degree|Postbaccalaureate certificate|Master's degree|Post-master's certificate|Doctor's degree - research/scholarship|Doctor's degree - professional practice","City: Large","Yes","6111","1781","74%","8%","Fall 2010","$29,781","-","167783","00220800"
"Smith College","Elm St, Northampton, Massachusetts 01063","www.smith.edu","4-year, Private not-for-profit","Bachelor's degree|Postbaccalaureate certificate|Master's degree|Post-master's certificate|Doctor's degree - research/scholarship","Suburb: Large","Yes","2896","2514","89%","9%","Fall 2010","$24,258","-","167835","00220900"
"Southeastern Technical Institute","250 Foundry St, South Easton, Massachusetts 02375","www.stitech.edu","< 2-year, Public","Less than one year certificate|One but less than two years certificate","Suburb: Large","No","130","130","63%","NA","2013-14","$14,183","Licensed Practical/Vocational Nurse Training","167871","01238600"
"Southern Worcester County Regional Voc School District","57 Old Muggett Hill Rd, Charlton, Massachusetts 01507-1331","www.baypath.net","< 2-year, Public","One but less than two years certificate","Rural: Fringe","No","26","26","88%","NA","2013-14","$21,643","Practical Nursing, Vocational Nursing and Nursing Assistants, Other","457624","04153200"
"Spa Tech Institute-Ipswich","126 High St, Ipswich, Massachusetts 01938","www.spatech.edu","< 2-year, Private for-profit","Less than one year certificate","Suburb: Large","No","59","59","100%","NA","2013-14","$17,052","Massage Therapy/Therapeutic Massage","445638","02104402"
"Spa Tech Institute-Plymouth","59 Industrial Park Rd, Plymouth, Massachusetts 02360","www.spatech.edu","< 2-year, Private for-profit","Less than one year certificate","Suburb: Large","No","162","162","79%","NA","2013-14","$17,562","Aesthetician/Esthetician and Skin Care Specialist","445656","02104404"
"Spa Tech Institute-Westboro","227 Turnpike Rd.  - Suite 1, Westboro, Massachusetts 01581","www.spatech.edu","< 2-year, Private for-profit","Less than one year certificate","Suburb: Large","No","111","111","73%","NA","2013-14","$14,889","Aesthetician/Esthetician and Skin Care Specialist","445647","02104403"
"Springfield College","263 Alden St, Springfield, Massachusetts 01109-3797","www.springfield.edu/","4-year, Private not-for-profit","Bachelor's degree|Master's degree|Post-master's certificate|Doctor's degree - research/scholarship|Doctor's degree - professional practice","City: Midsize","Yes","3144","2114","70%","NA","Fall 2010","$28,368","-","167899","00221100"
"Springfield College-School of Professional and Continuing Studies","Springfield College - School of Professional and Continuing Studies, Springfield, Massachusetts 01109","www.springfield.edu/school-of-professional-and-continuing-studies","4-year, Private not-for-profit","Bachelor's degree|Master's degree","City: Midsize","No","1383","992","NA","NA","Fall 2010","NA","-","475273","00221100"
"Springfield Technical Community College","1 Armory Sq, Springfield, Massachusetts 01105-1296","www.stcc.edu","2-year, Public","Less than one year certificate|One but less than two years certificate|Associate's degree","City: Midsize","No","5622","5622","21%","12%","Fall 2013","$8,243","-","167905","00807800"
"Stonehill College","320 Washington Street, Easton, Massachusetts 02357-6110","www.stonehill.edu","4-year, Private not-for-profit","Bachelor's degree","Suburb: Large","Yes","2481","2481","80%","NA","Fall 2010","$31,010","-","167996","00221700"
"Suffolk University","8 Ashburton Place, Boston, Massachusetts 02108-2770","www.suffolk.edu","4-year, Private not-for-profit","Less than one year certificate|One but less than two years certificate|Associate's degree|Two but less than 4 years certificate|Bachelor's degree|Postbaccalaureate certificate|Master's degree|Post-master's certificate|Doctor's degree - research/scholarship|Doctor's degree - professional practice","City: Large","Yes","7461","5191","59%","NA","Fall 2010","$30,498","-","168005","00221800"
"The New England Conservatory of Music","290 Huntington Ave, Boston, Massachusetts 02115-5018","necmusic.edu","4-year, Private not-for-profit","Two but less than 4 years certificate|Bachelor's degree|Postbaccalaureate certificate|Master's degree|Doctor's degree - research/scholarship","City: Large","Yes","819","413","81%","1%","Fall 2010","$41,095","-","167057","00219400"
"The New England Institute of Art","10 Brookline Place West, Brookline, Massachusetts 02445-7295","www.artinstitutes.edu/boston","4-year, Private for-profit","One but less than two years certificate|Associate's degree|Bachelor's degree","Suburb: Large","No","94","94","33%","NA","Fall 2010","NA","-","167321","00748600"
"The Salter School-Malden Campus","2 Florence Street, Malden, Massachusetts 02148","www.salterschool.com","< 2-year, Private for-profit","One but less than two years certificate","Suburb: Large","No","379","379","52%","NA","2013-14","$17,337","Medical/Clinical Assistant","442815","00466603"
"Toni & Guy Hairdressing Academy-Worcester","6 Park Avenue, Worcester, Massachusetts 01605-2213","worcester.toniguy.edu/","< 2-year, Private for-profit","One but less than two years certificate","City: Midsize","No","149","149","89%","1%","2013-14","$22,165","Cosmetology/Cosmetologist, General","434344","03240300"
