"Name","Address","Website","Type","Awards offered","Campus setting","Campus housing","Student population","Undergraduate students","Graduation Rate","Transfer-Out Rate","Cohort Year *","Net Price **","Largest Program","IPEDS ID","OPE ID"
"Aaniiih Nakoda College","269 Blackfeet Avenue Agency, Harlem, Montana 59526","www.ancollege.edu","2-year, Public","Less than one year certificate|One but less than two years certificate|Associate's degree","Rural: Remote","No","149","149","32%","8%","Fall 2013","$6,497","-","180203","02517500"
"Academy of Cosmetology","133 W Mendenhall, Bozeman, Montana 59715-3544","www.academycosmetology.com","2-year, Private for-profit","Two but less than 4 years certificate","Town: Remote","No","35","35","67%","NA","Fall 2013","$7,943","Cosmetology/Cosmetologist, General","179991","02621300"
"Bitterroot School of Cosmetology","2079 N First St Ste B, Hamilton, Montana 59840","bitterrootschoolofcosmetology.com","2-year, Private for-profit","Less than one year certificate|Two but less than 4 years certificate","Town: Remote","No","22","22","82%","NA","Fall 2013","$6,005","Cosmetology/Cosmetologist, General","457721","04163700"
"Blackfeet Community College","504 S. East Boundary, Browning, Montana 59417-0819","bfcc.edu","2-year, Private not-for-profit","One but less than two years certificate|Associate's degree","Rural: Fringe","No","425","425","25%","NA","Fall 2013","$6,830","-","180054","02510600"
"Bold Beauty Academy","928 Broadwater Ave, Suite C, Billings, Montana 59101","boldbeautyacademy.com","2-year, Private for-profit","Less than one year certificate|One but less than two years certificate|Two but less than 4 years certificate","City: Midsize","No","125","125","73%","NA","Fall 2013","$7,694","Cosmetology/Cosmetologist, General","444316","03763400"
"Butte Academy of Beauty Culture","303 W Park St, Butte, Montana 59701","butteacademyofbeauty.ipage.com/","2-year, Private for-profit","Two but less than 4 years certificate","Town: Remote","No","44","44","59%","7%","Fall 2013","$9,484","Cosmetology/Cosmetologist, General","180063","00790000"
"Carroll College","1601 N Benton Ave, Helena, Montana 59625-0002","www.carroll.edu","4-year, Private not-for-profit","Less than one year certificate|Associate's degree|Bachelor's degree","Town: Remote","Yes","1380","1380","66%","NA","Fall 2010","$25,449","-","180106","00252600"
"Chief Dull Knife College","1 College Drive, Lame Deer, Montana 59043","cdkc.edu","2-year, Public","One but less than two years certificate|Associate's degree","Rural: Remote","No","168","168","31%","8%","Fall 2013","$6,189","-","180160","02545200"
"City College Montana State University Billings","3803 Central Ave, Billings, Montana 59102-9856","www.msubillings.edu/citycollege/","2-year, Public","Less than one year certificate|One but less than two years certificate|Associate's degree|Two but less than 4 years certificate","City: Midsize","No","","","NA","NA","Fall 2013","NA","-","18017901","00253001"
"Crevier's Academy of Cosmetology Arts","240 West Idaho, Kalispell, Montana 59901","www.crevierschool.com","2-year, Private for-profit","Less than one year certificate|Two but less than 4 years certificate","Town: Remote","No","71","71","80%","NA","Fall 2013","$6,097","Cosmetology/Cosmetologist, General","180090","04187700"
"Dawson Community College","300 College Dr, Glendive, Montana 59330","www.dawson.edu","2-year, Public","One but less than two years certificate|Associate's degree","Town: Remote","Yes","297","297","37%","34%","Fall 2013","$8,657","-","180151","00252900"
"Flathead Valley Community College","777 Grandview Dr, Kalispell, Montana 59901","www.fvcc.edu","2-year, Public","Less than one year certificate|One but less than two years certificate|Associate's degree","Rural: Fringe","No","2266","2266","28%","18%","Fall 2013","$8,298","-","180197","00677700"
"Fort Peck Community College","605 Indian Street, Poplar, Montana 59255-0398","www.fpcc.edu","2-year, Public","One but less than two years certificate|Associate's degree","Town: Remote","Yes","385","385","7%","2%","Fall 2013","$6,461","-","180212","02343000"
"Great Falls College Montana State University","2100 16th Ave S, Great Falls, Montana 59405","www.gfcmsu.edu","2-year, Public","Less than one year certificate|One but less than two years certificate|Associate's degree","City: Small","No","1674","1674","20%","19%","Fall 2013","$9,177","-","180249","00931400"
"Health Works Institute","407 West Main Street, Bozeman, Montana 59715","www.healthworks.edu","< 2-year, Private for-profit","Less than one year certificate|One but less than two years certificate","Town: Remote","No","33","33","92%","8%","2013-14","$22,038","Massage Therapy/Therapeutic Massage","444644","03778300"
"Helena College University of Montana","1115 N Roberts Street, Helena, Montana 59601","www.helenacollege.edu","2-year, Public","Less than one year certificate|One but less than two years certificate|Associate's degree","Town: Remote","No","1396","1396","33%","17%","Fall 2013","$10,335","-","180276","00757000"
"Highlands College of Montana Tech","25 Basin Creek Rd, Butte, Montana 59701","www.mtech.edu/","2-year, Public","Less than one year certificate|One but less than two years certificate|Associate's degree","Town: Remote","Yes","777","777","20%","13%","Fall 2013","$9,507","-","180081","00253101"
"Little Big Horn College","8645 South Weaver Drive, Crow Agency, Montana 59022","www.lbhc.edu/","2-year, Public","One but less than two years certificate|Associate's degree","Rural: Remote","No","223","223","22%","2%","Fall 2013","$6,756","-","180328","02286600"
"Miles Community College","2715 Dickinson Street, Miles City, Montana 59301-4774","www.milescc.edu/","2-year, Public","One but less than two years certificate|Associate's degree","Town: Remote","Yes","497","497","40%","22%","Fall 2013","$7,535","-","180373","00252800"
"Montana Academy of Salons","501 2nd St S, Great Falls, Montana 59405","montanabeautyschool.com","2-year, Private for-profit","Less than one year certificate|One but less than two years certificate|Two but less than 4 years certificate","City: Small","No","69","69","72%","NA","Fall 2013","$11,900","Cosmetology/Cosmetologist, General","457749","04164100"
"Montana Bible College","3625 S 19th Ave, Bozeman, Montana 59718","www.montanabiblecollege.edu","4-year, Private not-for-profit","One but less than two years certificate|Bachelor's degree","Rural: Fringe","Yes","","","NA","NA","Fall 2010","NA","-","262165","04140300"
"Montana State University","Montana State University, Bozeman, Montana 59717","www.montana.edu/","4-year, Public","One but less than two years certificate|Associate's degree|Bachelor's degree|Postbaccalaureate certificate|Master's degree|Doctor's degree - research/scholarship|Doctor's degree - professional practice","Town: Remote","Yes","16359","14340","53%","NA","Fall 2010","$14,953","-","180461","00253200"
"Montana State University-Billings","1500 University Drive, Billings, Montana 59101-0298","www.msubillings.edu","4-year, Public","Associate's degree|Bachelor's degree|Master's degree","City: Midsize","Yes","4362","3968","24%","24%","Fall 2010","$11,680","-","180179","00253000"
"Montana State University-Northern","300 W 11th St, Havre, Montana 59501","www.msun.edu","4-year, Public","One but less than two years certificate|Associate's degree|Bachelor's degree|Master's degree","Town: Remote","Yes","1207","1139","26%","NA","Fall 2010","$10,523","-","180522","00253300"
"Montana Tech of the University of Montana","1300 W Park St, Butte, Montana 59701-8997","www.mtech.edu","4-year, Public","Associate's degree|Bachelor's degree|Postbaccalaureate certificate|Master's degree|Doctor's degree - research/scholarship","Town: Remote","Yes","2032","1817","46%","26%","Fall 2010","$12,385","-","180416","00253100"
"Pima Medical Institute-Dillon","434 E. Poindexter Street, Dillon, Montana 59725-3581","www.pmi.edu","2-year, Private for-profit","Less than one year certificate|Associate's degree","Town: Remote","No","35","35","NA","NA","Fall 2013","$14,712","Veterinary/Animal Health Technology/Technician and Veterinary Assistant","489812","03678301"
"Rocky Mountain College","1511 Poly Drive, Billings, Montana 59102-1796","rocky.edu","4-year, Private not-for-profit","Associate's degree|Bachelor's degree|Master's degree","City: Midsize","Yes","1000","908","48%","NA","Fall 2010","$19,412","-","180595","00253400"
"Salish Kootenai College","58138 US  Highway 93, Pablo, Montana 59855","www.skc.edu","4-year, primarily associate's, Private not-for-profit","One but less than two years certificate|Associate's degree|Bachelor's degree","Rural: Distant","Yes","859","859","53%","NA","Fall 2010","$8,648","-","180647","02143400"
"Stone Child College","8294 Upper Box Elder Road, Box Elder, Montana 59521-9796","www.stonechild.edu","2-year, Public","One but less than two years certificate|Associate's degree","Rural: Remote","No","544","544","11%","21%","Fall 2013","$7,396","-","366340","02610900"
"The University of Montana","Missoula, Montana, Missoula, Montana 59812","www.umt.edu","4-year, Public","Less than one year certificate|One but less than two years certificate|Associate's degree|Two but less than 4 years certificate|Bachelor's degree|Postbaccalaureate certificate|Master's degree|Post-master's certificate|Doctor's degree - research/scholarship|Doctor's degree - professional practice","City: Small","Yes","12419","10077","45%","NA","Fall 2010","$13,894","-","180489","00253600"
"The University of Montana - Missoula College","909 South Ave W, Missoula, Montana 59812","www.umt.edu","2-year, Public","Less than one year certificate|One but less than two years certificate|Associate's degree","City: Small","No","","","NA","NA","Fall 2013","NA","-","18048901",""
"The University of Montana-Western","710 S Atlantic, Dillon, Montana 59725-3598","w.umwestern.edu/","4-year, Public","Less than one year certificate|One but less than two years certificate|Associate's degree|Bachelor's degree","Town: Remote","Yes","1505","1505","46%","29%","Fall 2010","$10,768","-","180692","00253700"
"University of Providence","1301 Twentieth St S, Great Falls, Montana 59405-4996","www.uprovidence.edu","4-year, Private not-for-profit","Less than one year certificate|Associate's degree|Bachelor's degree|Postbaccalaureate certificate|Master's degree","City: Small","Yes","957","883","31%","45%","Fall 2010","$20,247","-","180258","00252700"
"","* Cohort Year represents the year for which students began their studies and applies to Graduation and Transfer Out Rates.","","","","","","","","","","","","","",""
"","** Net Price is Average Net Price for 2015-2016 generated for full-time beginning undergraduate students who were awarded grant or scholarship aid from federal, state or local governments, or the institution. For public institutions only students paying the in-state or in-district rate are included.  For institutions that charge students by program, net price is generated for the institution’s largest program.","","","","","","","","","","","","","",""
"","NA (Not applicable) - Graduation rate, transfer-out rate and the net price are not applicable to institutions that do not have full-time, first-time degree-seeking undergraduate students in the applicable cohort year or the financial aid year.","","","","","","","","","","","","","",""
